{
  "version": "1.0",
  "module": {
    "id": "combat",
    "name": "Combat",
    "kind": "system",
    "entry": "modules/combat/index.ts",
    "templateId": "idle-rpg-base"
  },
  "provides": {
    "events": ["combat.ready"],
    "state": ["state.combat"],
    "commands": []
  },
  "consumes": {
    "events": ["idle.tick"],
    "state": ["state.idle"],
    "commands": []
  },
  "files": [
    {
      "path": "modules/combat/index.ts",
      "role": "logic",
      "sha256": "a5f4ef05a7d83e404448dbdf0f63d0405a2d4f32243f6afc4a59d43dea68af1b"
    }
  ]
}
